{
  "manifest_origin": "orchestrator_unverified",
  "attestation_source": null,
  "isolation_status": "ISOLATION_NOT_VERIFIED",
  "audits": {
    "10B1": {
      "audit_id": "10B1",
      "execution_id": null,
      "context_mode": "same_context_unverified",
      "allowed_input_files": [
        "10_final_candidate.md",
        "10_final_sentence_index.json"
      ],
      "observed_input_files": [
        "10_final_candidate.md",
        "10_final_sentence_index.json"
      ],
      "observed_input_hashes": {
        "10_final_candidate.md": "4f214e3345a6eb9285cada231018ed8fc6516097d4d9fd64505fb4d1ab072e6a",
        "10_final_sentence_index.json": "f8082cb01eeb8087bd853b44af3cdde653415940b528d1ba237542f6de387842"
      },
      "forbidden_input_files": [],
      "forbidden_input_accessed": null,
      "runtime_attested": false
    },
    "10B2": {
      "audit_id": "10B2",
      "execution_id": null,
      "context_mode": "same_context_unverified",
      "allowed_input_files": [
        "10_final_candidate.md",
        "10_final_sentence_index.json"
      ],
      "observed_input_files": [
        "10_final_candidate.md",
        "10_final_sentence_index.json"
      ],
      "observed_input_hashes": {
        "10_final_candidate.md": "4f214e3345a6eb9285cada231018ed8fc6516097d4d9fd64505fb4d1ab072e6a",
        "10_final_sentence_index.json": "f8082cb01eeb8087bd853b44af3cdde653415940b528d1ba237542f6de387842"
      },
      "forbidden_input_files": [],
      "forbidden_input_accessed": null,
      "runtime_attested": false
    },
    "10B3": {
      "audit_id": "10B3",
      "execution_id": null,
      "context_mode": "same_context_unverified",
      "allowed_input_files": [
        "10_final_candidate.md",
        "10_final_sentence_index.json"
      ],
      "observed_input_files": [
        "10_final_candidate.md",
        "10_final_sentence_index.json"
      ],
      "observed_input_hashes": {
        "10_final_candidate.md": "4f214e3345a6eb9285cada231018ed8fc6516097d4d9fd64505fb4d1ab072e6a",
        "10_final_sentence_index.json": "f8082cb01eeb8087bd853b44af3cdde653415940b528d1ba237542f6de387842"
      },
      "forbidden_input_files": [],
      "forbidden_input_accessed": null,
      "runtime_attested": false
    }
  }
}
