{
  "manifest_origin": "orchestrator_unverified",
  "attestation_source": null,
  "isolation_status": "ISOLATION_NOT_VERIFIED",
  "audits": {
    "10B1": {
      "audit_id": "10B1",
      "execution_id": null,
      "context_mode": "same_context_unverified",
      "allowed_input_files": [
        "10_final_candidate.md",
        "10_final_sentence_index.json"
      ],
      "observed_input_files": [
        "10_final_candidate.md",
        "10_final_sentence_index.json"
      ],
      "observed_input_hashes": {
        "10_final_candidate.md": "e44dc71eaefb64ab39753655416e8313d4841c5c2546b09ff36d7703eec8a0b2",
        "10_final_sentence_index.json": "a758943a445fa01740de451e6a7dab55d63f5f9bb626f0bcda3df8b159298bac"
      },
      "forbidden_input_files": [
        "03_knowledge_graph.json",
        "06_knowledge_closure.json"
      ],
      "forbidden_input_accessed": null,
      "runtime_attested": false
    },
    "10B2": {
      "audit_id": "10B2",
      "execution_id": null,
      "context_mode": "same_context_unverified",
      "allowed_input_files": [
        "10_final_candidate.md",
        "10_final_sentence_index.json"
      ],
      "observed_input_files": [
        "10_final_candidate.md",
        "10_final_sentence_index.json"
      ],
      "observed_input_hashes": {
        "10_final_candidate.md": "e44dc71eaefb64ab39753655416e8313d4841c5c2546b09ff36d7703eec8a0b2",
        "10_final_sentence_index.json": "a758943a445fa01740de451e6a7dab55d63f5f9bb626f0bcda3df8b159298bac"
      },
      "forbidden_input_files": [
        "03_claim_map.json",
        "02_sources.json",
        "02_evidence_ledger.json",
        "09_fact_check.md"
      ],
      "forbidden_input_accessed": null,
      "runtime_attested": false
    },
    "10B3": {
      "audit_id": "10B3",
      "execution_id": null,
      "context_mode": "same_context_unverified",
      "allowed_input_files": [
        "10_final_candidate.md",
        "10_final_sentence_index.json"
      ],
      "observed_input_files": [
        "10_final_candidate.md",
        "10_final_sentence_index.json"
      ],
      "observed_input_hashes": {
        "10_final_candidate.md": "e44dc71eaefb64ab39753655416e8313d4841c5c2546b09ff36d7703eec8a0b2",
        "10_final_sentence_index.json": "a758943a445fa01740de451e6a7dab55d63f5f9bb626f0bcda3df8b159298bac"
      },
      "forbidden_input_files": [
        "07_reveal_audit.json",
        "08_naturalness_audit.json"
      ],
      "forbidden_input_accessed": null,
      "runtime_attested": false
    }
  }
}
