{
  "manifest_origin": "orchestrator_unverified",
  "attestation_source": null,
  "isolation_status": "ISOLATION_NOT_VERIFIED",
  "audits": {
    "10B1": {
      "audit_id": "10B1",
      "execution_id": null,
      "context_mode": "same_context_unverified",
      "allowed_input_files": [
        "10_final_candidate.md",
        "10_final_sentence_index.json"
      ],
      "observed_input_files": [
        "10_final_candidate.md",
        "10_final_sentence_index.json"
      ],
      "observed_input_hashes": {
        "10_final_candidate.md": "a10d854e00cd56e5a55c2809cf59f7eece5da95f5d1716c7c74f3a57e1a04961",
        "10_final_sentence_index.json": "5761d432ddc503c8105c5785b5f2e59c21d785af94298673c81d6fa93308d094"
      },
      "forbidden_input_files": [],
      "forbidden_input_accessed": null,
      "runtime_attested": false
    },
    "10B2": {
      "audit_id": "10B2",
      "execution_id": null,
      "context_mode": "same_context_unverified",
      "allowed_input_files": [
        "10_final_candidate.md",
        "10_final_sentence_index.json"
      ],
      "observed_input_files": [
        "10_final_candidate.md",
        "10_final_sentence_index.json"
      ],
      "observed_input_hashes": {
        "10_final_candidate.md": "a10d854e00cd56e5a55c2809cf59f7eece5da95f5d1716c7c74f3a57e1a04961",
        "10_final_sentence_index.json": "5761d432ddc503c8105c5785b5f2e59c21d785af94298673c81d6fa93308d094"
      },
      "forbidden_input_files": [],
      "forbidden_input_accessed": null,
      "runtime_attested": false
    },
    "10B3": {
      "audit_id": "10B3",
      "execution_id": null,
      "context_mode": "same_context_unverified",
      "allowed_input_files": [
        "10_final_candidate.md",
        "10_final_sentence_index.json"
      ],
      "observed_input_files": [
        "10_final_candidate.md",
        "10_final_sentence_index.json"
      ],
      "observed_input_hashes": {
        "10_final_candidate.md": "a10d854e00cd56e5a55c2809cf59f7eece5da95f5d1716c7c74f3a57e1a04961",
        "10_final_sentence_index.json": "5761d432ddc503c8105c5785b5f2e59c21d785af94298673c81d6fa93308d094"
      },
      "forbidden_input_files": [],
      "forbidden_input_accessed": null,
      "runtime_attested": false
    }
  }
}
