{
  "manifest_origin": "orchestrator_unverified",
  "attestation_source": null,
  "isolation_status": "ISOLATION_NOT_VERIFIED",
  "audits": {
    "10B1": {
      "audit_id": "10B1",
      "execution_id": null,
      "context_mode": "same_context_unverified",
      "allowed_input_files": [
        "10_final_candidate.md",
        "10_final_sentence_index.json"
      ],
      "observed_input_files": [
        "10_final_candidate.md",
        "10_final_sentence_index.json"
      ],
      "observed_input_hashes": {
        "10_final_candidate.md": "df084a3922c7b22ab2013dedc884aad871494d04f2409753a1cc175cb506977e",
        "10_final_sentence_index.json": "d133686a770831edd3a3908f601ed90c640e8a551c9c44098199d997e2cd710d"
      },
      "forbidden_input_files": [
        "03_knowledge_graph.json",
        "06_knowledge_closure.json"
      ],
      "forbidden_input_accessed": null,
      "runtime_attested": false
    },
    "10B2": {
      "audit_id": "10B2",
      "execution_id": null,
      "context_mode": "same_context_unverified",
      "allowed_input_files": [
        "10_final_candidate.md",
        "10_final_sentence_index.json"
      ],
      "observed_input_files": [
        "10_final_candidate.md",
        "10_final_sentence_index.json"
      ],
      "observed_input_hashes": {
        "10_final_candidate.md": "df084a3922c7b22ab2013dedc884aad871494d04f2409753a1cc175cb506977e",
        "10_final_sentence_index.json": "d133686a770831edd3a3908f601ed90c640e8a551c9c44098199d997e2cd710d"
      },
      "forbidden_input_files": [
        "03_claim_map.json",
        "02_sources.json",
        "02_evidence_ledger.json",
        "09_fact_check.md"
      ],
      "forbidden_input_accessed": null,
      "runtime_attested": false
    },
    "10B3": {
      "audit_id": "10B3",
      "execution_id": null,
      "context_mode": "same_context_unverified",
      "allowed_input_files": [
        "10_final_candidate.md",
        "10_final_sentence_index.json"
      ],
      "observed_input_files": [
        "10_final_candidate.md",
        "10_final_sentence_index.json"
      ],
      "observed_input_hashes": {
        "10_final_candidate.md": "df084a3922c7b22ab2013dedc884aad871494d04f2409753a1cc175cb506977e",
        "10_final_sentence_index.json": "d133686a770831edd3a3908f601ed90c640e8a551c9c44098199d997e2cd710d"
      },
      "forbidden_input_files": [
        "07_reveal_audit.json",
        "08_naturalness_audit.json"
      ],
      "forbidden_input_accessed": null,
      "runtime_attested": false
    }
  }
}
